item,itemLabel,position,positionLabel,start,psid
Q102077694,Rodolfo Solano Quirós,Q6402752,Minister of Foreign Affairs,2020-01-01,Q102077694-E5E59BF2-7B43-4FB1-BFA4-9704BE0B4487
Q111524163,Mary Munive,Q7925043,Vice President of Costa Rica,2022-05-08,Q111524163-F18648D9-E083-4842-9E11-E73075D00CB0
Q111677386,Stephan Brunner,Q7925043,Vice President of Costa Rica,2022-05-08,Q111677386-FFE42EE4-5B9C-412E-8112-686BF8D75CD0
Q28501930,Natalia Díaz Quintana,Q52244184,Minister of the Presidency of Costa Rica,2022-05-08,Q28501930-f1ca154f-4011-c8ac-ded1-8223b0add838
Q98017689,Rodrigo Alberto de Jesús Chaves Robles,Q27977064,President of Costa Rica,2022-05-08,Q98017689-2B88608A-801E-46D6-B4F6-160098F28CB7
